CharacterName,DialogueText,HasChoices,Choice1Text,Choice1NextIndex,Choice2Text,Choice2NextIndex,Expression,IsReturnPoint,IsEndPoint,OnDialogueCompleteMethod,IsDeadly
自言自语,室外逃生梯遇到狂风，危险！是否要走这条路？,True,是,2,否,7,0,0,0,,0
自言自语,是否有要提示家人的？,True,是,3,否,5,0,0,0,,0
自言自语,大家快蹲下贴着墙走，台风期间强风可能使室外逃生梯这种开放或半开放结构不稳固，还可能被飞来物砸伤人。贴着墙走或许有一线生机。,False,,,,-1,1,0,0,,0
自言自语,终于逃出来了！快去大使馆吧！,False,,,,-1,0,0,1,,0
自言自语,你没有提醒家人，在台风中不幸丧生...,False,,,,-1,2,0,0,,1
自言自语,看看还有没有更好的逃生路线或者做法？,False,,,,-1,0,0,1,,0
自言自语,看看其他路线？,False,,,,-1,0,0,1,,0